{
  "$schema": "http://json-schema.org/draft-04/schema#",
  "javaType" : "com.bt.nextgen.api.draftaccount.schemas.v1.DirectClientApplicationFormData",
  "type": "object",
  "properties": {
    "version": {
      "type": "string",
      "description": "this is the application Account JSON Schema Version number supported by client & server (http://semver.org/)",
      "pattern": "^[1-99]{1}.[0-99]{1}.[0-99]{1}$"
    },
    "accountType": {
      "$ref": "base/directAccountTypeEnum.json"
    },
    "pensioneligibility": {
      "type": "object",
      "$ref": "pensioneligibility/pensionEligibilitySchema.json",
      "description": "This schema is used for the Super Pension eligibility applicable only for super pension account."
    },
    "applicationOrigin" : {
      "$ref": "base/directApplicationOriginTypeEnum.json"
    },
    "adviceType" : {
      "$ref": "base/directAdviceTypeEnum.json"
    },
    "investors": {
      "type": "array",
      "items": {
        "$ref" : "customer/customerSchema.json"
      }
    },
    "linkedaccounts": {
      "$ref": "linkedaccounts/linkedAccountsApplicationSchema.json"
    },
    "investmentoptions": {
      "$ref": "investmentChoice/investmentChoiceSchema.json"
    }
  },
  "required": [
    "version",
    "investors"
  ],
  "additionalProperties": false
}
