{
  "version": "1.0.0",
  "applicationOrigin": "WestpacLive",
  "investors": [
    {
      "cisId": "1234567892",
      "userName": "83916530",
      "idVerified": true,
      "title": "MR",
      "firstname": "SAURABH",
      "lastname": "BHARGAVA",
      "dateofbirth": "10/01/1992",
      "gender": "male",
      "preferredcontact": "mobile",
      "resaddress": {
        "unitNumber": "6",
        "floor": "55",
        "streetNumber": "45",
        "streetName": "Kent",
        "streetType": "St",
        "building": "Ece Arc",
        "suburb": "Sydney",
        "state": "NSW",
        "stateAbbr": "NSW",
        "city": "Sydney",
        "postcode": "2000",
        "country": "AU",
        "domicile": true,
        "mailingAddress": true,
        "addressType": "residential",
        "internationalAddress": false,
        "standardAddressFormat": true,
        "componentised": true,
        "pin": "2000"
      },
      "postaladdress": {
        "unitNumber": "6",
        "floor": "55",
        "streetNumber": "45",
        "streetName": "Kent",
        "streetType": "St",
        "building": "Ece Arc",
        "suburb": "Sydney",
        "state": "NSW",
        "stateAbbr": "NSW",
        "city": "Sydney",
        "postcode": "2000",
        "country": "AU",
        "domicile": true,
        "mailingAddress": true,
        "addressType": "residential",
        "internationalAddress": false,
        "standardAddressFormat": true,
        "componentised": true,
        "pin": "2000"
      },
      "email": {
        "value": "DS@DS.COM"
      },
      "mobile": {
        "value": "D5A37ED46E70AE3443CB5DC34E2377C22F90F04FA389EF991B19F243057129E6"
      },
      "taxdetails": {
        "ausTaxDetails": {
          "tfn": {},
          "taxOption": {
            "value": "Exemption Reason provided"
          },
          "exemptionReason": {
            "value": "norfolk_island_res"
          },
          "isTaxCountryAus": {
            "value": true
          }
        },
        "selectedOverseasTaxCountry": {
          "value": "AU"
        }
      }
    }
  ],
  "linkedaccounts": {
    "primaryLinkedAccount": {
      "accountname": "My Personal Account",
      "bsb": "732095",
      "accountnumber": "596137",
      "bsbValidationResultVal": true
    },
    "otherLinkedAccount": []
  }
}