{
  "version": "1.0.0",
  "applicationOrigin": "WestpacLive",
  "accountType": "superAccumulation",
  "investors": [
    {
      "cisId": "57546320070",
      "userName": "75364576",
      "idVerified": true,
      "title": "MR",
      "firstname": "REGISTERONE",
      "lastname": "TEST",
      "dateofbirth": "05/02/1989",
      "gender": "male",
      "preferredcontact": "mobile",
      "resaddress": {
        "streetNumber": "33",
        "streetName": "Pitt Town",
        "streetType": "Rd",
        "suburb": "Kenthurst",
        "state": "NSW",
        "stateAbbr": "NSW",
        "city": "Kenthurst",
        "postcode": "2156",
        "country": "AU",
        "domicile": true,
        "mailingAddress": true,
        "addressType": "residential",
        "internationalAddress": false,
        "standardAddressFormat": true,
        "componentised": true,
        "pin": "2156"
      },
      "postaladdress": {
        "streetNumber": "33",
        "streetName": "Pitt Town",
        "streetType": "Rd",
        "suburb": "Kenthurst",
        "state": "NSW",
        "stateAbbr": "NSW",
        "city": "Kenthurst",
        "postcode": "2156",
        "country": "AU",
        "domicile": true,
        "mailingAddress": true,
        "addressType": "residential",
        "internationalAddress": false,
        "standardAddressFormat": true,
        "componentised": true,
        "pin": "2156"
      },
      "tfn": "11111111",
      "taxoption": "Tax File Number provided",
      "taxcountry": "AU",
      "key": {
        "clientId": "9055D5F318B9C6767627E539ADCEDAA7A6F4A52F926D4D6F"
      }
    }
  ]
}
